{
  "file": "open_questions.json",
  "schema_version": "0.1.0",
  "updated": "2026-10-21",
  "claim_model": {
    "value": "...",
    "units": "...",
    "precision": "...",
    "inference_score": 0,
    "source_ids": [
      "..."
    ]
  },
  "sources": [
    {
      "source_id": "TCS-WWKC-WEB-0001",
      "title": "The Cruel Song – Who Was Karmein Chan?",
      "url": "https://thecruelsong.com/",
      "locators": [
        "#public-questions-about-the-karmein-chan-case",
        "#questions-about-karmein-chan-herself"
      ]
    }
  ],
  "open_questions": [
    {
      "id": "KCQST0001",
      "record_type": "open_question",
      "category": {
        "value": "public_questions_about_the_karmein_chan_case",
        "units": "open_question_category",
        "precision": "section_slug",
        "inference_score": 0,
        "source_ids": [
          "TCS-WWKC-WEB-0001"
        ]
      },
      "question": {
        "value": "Who was the last person outside the family to see Karmein Chan alive?",
        "units": "question_text",
        "precision": "verbatim_from_source",
        "inference_score": 0,
        "source_ids": [
          "TCS-WWKC-WEB-0001"
        ]
      },
      "status": {
        "value": "open",
        "units": "question_status",
        "precision": "current_status",
        "inference_score": 0,
        "source_ids": [
          "TCS-WWKC-WEB-0001"
        ]
      },
      "source_locator": {
        "value": "#public-questions-about-the-karmein-chan-case",
        "units": "html_anchor",
        "precision": "section_anchor",
        "inference_score": 0,
        "source_ids": [
          "TCS-WWKC-WEB-0001"
        ]
      },
      "related_person_ids": [],
      "related_place_ids": [],
      "related_event_ids": [],
      "review_flags": []
    },
    {
      "id": "KCQST0002",
      "record_type": "open_question",
      "category": {
        "value": "public_questions_about_the_karmein_chan_case",
        "units": "open_question_category",
        "precision": "section_slug",
        "inference_score": 0,
        "source_ids": [
          "TCS-WWKC-WEB-0001"
        ]
      },
      "question": {
        "value": "Were the phone lines cut?",
        "units": "question_text",
        "precision": "verbatim_from_source",
        "inference_score": 0,
        "source_ids": [
          "TCS-WWKC-WEB-0001"
        ]
      },
      "status": {
        "value": "open",
        "units": "question_status",
        "precision": "current_status",
        "inference_score": 0,
        "source_ids": [
          "TCS-WWKC-WEB-0001"
        ]
      },
      "source_locator": {
        "value": "#public-questions-about-the-karmein-chan-case",
        "units": "html_anchor",
        "precision": "section_anchor",
        "inference_score": 0,
        "source_ids": [
          "TCS-WWKC-WEB-0001"
        ]
      },
      "related_person_ids": [],
      "related_place_ids": [],
      "related_event_ids": [],
      "review_flags": []
    },
    {
      "id": "KCQST0003",
      "record_type": "open_question",
      "category": {
        "value": "public_questions_about_the_karmein_chan_case",
        "units": "open_question_category",
        "precision": "section_slug",
        "inference_score": 0,
        "source_ids": [
          "TCS-WWKC-WEB-0001"
        ]
      },
      "question": {
        "value": "What do we really know about Karmein Chan’s behavior during the home invasion?",
        "units": "question_text",
        "precision": "verbatim_from_source",
        "inference_score": 0,
        "source_ids": [
          "TCS-WWKC-WEB-0001"
        ]
      },
      "status": {
        "value": "open",
        "units": "question_status",
        "precision": "current_status",
        "inference_score": 0,
        "source_ids": [
          "TCS-WWKC-WEB-0001"
        ]
      },
      "source_locator": {
        "value": "#public-questions-about-the-karmein-chan-case",
        "units": "html_anchor",
        "precision": "section_anchor",
        "inference_score": 0,
        "source_ids": [
          "TCS-WWKC-WEB-0001"
        ]
      },
      "related_person_ids": [],
      "related_place_ids": [],
      "related_event_ids": [],
      "review_flags": []
    },
    {
      "id": "KCQST0004",
      "record_type": "open_question",
      "category": {
        "value": "public_questions_about_the_karmein_chan_case",
        "units": "open_question_category",
        "precision": "section_slug",
        "inference_score": 0,
        "source_ids": [
          "TCS-WWKC-WEB-0001"
        ]
      },
      "question": {
        "value": "Did the abductor know that Karmein had asthma?",
        "units": "question_text",
        "precision": "verbatim_from_source",
        "inference_score": 0,
        "source_ids": [
          "TCS-WWKC-WEB-0001"
        ]
      },
      "status": {
        "value": "open",
        "units": "question_status",
        "precision": "current_status",
        "inference_score": 0,
        "source_ids": [
          "TCS-WWKC-WEB-0001"
        ]
      },
      "source_locator": {
        "value": "#public-questions-about-the-karmein-chan-case",
        "units": "html_anchor",
        "precision": "section_anchor",
        "inference_score": 0,
        "source_ids": [
          "TCS-WWKC-WEB-0001"
        ]
      },
      "related_person_ids": [],
      "related_place_ids": [],
      "related_event_ids": [],
      "review_flags": []
    },
    {
      "id": "KCQST0005",
      "record_type": "open_question",
      "category": {
        "value": "public_questions_about_the_karmein_chan_case",
        "units": "open_question_category",
        "precision": "section_slug",
        "inference_score": 0,
        "source_ids": [
          "TCS-WWKC-WEB-0001"
        ]
      },
      "question": {
        "value": "Is there any evidence that Karmein Chan was taken to the same hideout as the other victims?",
        "units": "question_text",
        "precision": "verbatim_from_source",
        "inference_score": 0,
        "source_ids": [
          "TCS-WWKC-WEB-0001"
        ]
      },
      "status": {
        "value": "open",
        "units": "question_status",
        "precision": "current_status",
        "inference_score": 0,
        "source_ids": [
          "TCS-WWKC-WEB-0001"
        ]
      },
      "source_locator": {
        "value": "#public-questions-about-the-karmein-chan-case",
        "units": "html_anchor",
        "precision": "section_anchor",
        "inference_score": 0,
        "source_ids": [
          "TCS-WWKC-WEB-0001"
        ]
      },
      "related_person_ids": [],
      "related_place_ids": [],
      "related_event_ids": [],
      "review_flags": []
    },
    {
      "id": "KCQST0006",
      "record_type": "open_question",
      "category": {
        "value": "public_questions_about_the_karmein_chan_case",
        "units": "open_question_category",
        "precision": "section_slug",
        "inference_score": 0,
        "source_ids": [
          "TCS-WWKC-WEB-0001"
        ]
      },
      "question": {
        "value": "What was the exact distance between the abduction site and the place where her body was found?",
        "units": "question_text",
        "precision": "verbatim_from_source",
        "inference_score": 0,
        "source_ids": [
          "TCS-WWKC-WEB-0001"
        ]
      },
      "status": {
        "value": "open",
        "units": "question_status",
        "precision": "current_status",
        "inference_score": 0,
        "source_ids": [
          "TCS-WWKC-WEB-0001"
        ]
      },
      "source_locator": {
        "value": "#public-questions-about-the-karmein-chan-case",
        "units": "html_anchor",
        "precision": "section_anchor",
        "inference_score": 0,
        "source_ids": [
          "TCS-WWKC-WEB-0001"
        ]
      },
      "related_person_ids": [],
      "related_place_ids": [],
      "related_event_ids": [],
      "review_flags": []
    },
    {
      "id": "KCQST0007",
      "record_type": "open_question",
      "category": {
        "value": "public_questions_about_the_karmein_chan_case",
        "units": "open_question_category",
        "precision": "section_slug",
        "inference_score": 0,
        "source_ids": [
          "TCS-WWKC-WEB-0001"
        ]
      },
      "question": {
        "value": "Why did the perpetrator choose to kill Karmein, when previous victims had been released?",
        "units": "question_text",
        "precision": "verbatim_from_source",
        "inference_score": 0,
        "source_ids": [
          "TCS-WWKC-WEB-0001"
        ]
      },
      "status": {
        "value": "open",
        "units": "question_status",
        "precision": "current_status",
        "inference_score": 0,
        "source_ids": [
          "TCS-WWKC-WEB-0001"
        ]
      },
      "source_locator": {
        "value": "#public-questions-about-the-karmein-chan-case",
        "units": "html_anchor",
        "precision": "section_anchor",
        "inference_score": 0,
        "source_ids": [
          "TCS-WWKC-WEB-0001"
        ]
      },
      "related_person_ids": [],
      "related_place_ids": [],
      "related_event_ids": [],
      "review_flags": []
    },
    {
      "id": "KCQST0008",
      "record_type": "open_question",
      "category": {
        "value": "public_questions_about_the_karmein_chan_case",
        "units": "open_question_category",
        "precision": "section_slug",
        "inference_score": 0,
        "source_ids": [
          "TCS-WWKC-WEB-0001"
        ]
      },
      "question": {
        "value": "What was the likely route taken by the abductor between Templestowe and Edgars Creek?",
        "units": "question_text",
        "precision": "verbatim_from_source",
        "inference_score": 0,
        "source_ids": [
          "TCS-WWKC-WEB-0001"
        ]
      },
      "status": {
        "value": "open",
        "units": "question_status",